{
  "schemaVersion": 1,
  "host": "codex",
  "hostVersion": "1.2.3",
  "versionRange": {
    "major": 1,
    "minor": 2,
    "minPatch": 3
  },
  "os": {
    "platform": "linux",
    "release": "6.8.0",
    "arch": "x64"
  },
  "adapterRevision": 1,
  "nmzpVersion": "0.2.6",
  "nmzpCommit": "aaaaaaaaaaaaaaaaaaaaaaaaaaaaaaaaaaaaaaaa",
  "actions": [
    {
      "action": "BLOCK",
      "scenarioId": "codex/block",
      "scenarioSha256": "2054f2c87548eee31f5cbb8c8b814d77959ee5b2858302bda0bb825086e90d1c",
      "expected": {
        "decision": "block",
        "ruleId": "env_piped_outbound"
      },
      "observed": {
        "resultFile": "missing",
        "resultText": null,
        "uiDenied": true
      },
      "verdict": "PASS",
      "evidence": {
        "logSha256": [],
        "screenshots": [
          "fixture.png"
        ]
      }
    },
    {
      "action": "REWRITE",
      "scenarioId": "codex/rewrite",
      "scenarioSha256": "258658098b0cd57d0e33fbca348622f3e018d51bff5c4665752d53be678833a6",
      "expected": {
        "decision": "rewrite",
        "ruleId": "privacy:host_real"
      },
      "observed": {
        "resultFile": "present",
        "resultText": "NMZPHRSAFE",
        "uiDenied": null
      },
      "verdict": "PASS",
      "evidence": {
        "logSha256": [],
        "screenshots": [
          "fixture.png"
        ]
      }
    }
  ],
  "trustSteps": [
    "fixture only: not a signed host run"
  ],
  "recordedAt": "2026-10-08T00:00:00Z",
  "recordedBy": "human",
  "ref": "artifact:host-real/codex/1.2.3"
}
